<?xml version="1.0" encoding="UTF-8"?>

<!--
    Document   : access.xml
    Created on : September 23, 2008, 1:41 PM
    Author     : sdorra
    Description:
        Purpose of the document follows.
-->
<access-config  xmlns:xsi='http://www.w3.org/2001/XMLSchema-instance'
                xmlns='http://dev.sonia.de/schema/accessConfig'
                xsi:schemaLocation='http://dev.sonia.de/schema/accessConfig file:///Users/sdorra/Projects/jab/SoniaWebUtil/src/main/resources/sonia/jsf/access/accessConfig.xsd'>

  <rule>
    <description>if app installed</description>
    <conditions>
      <not>
        <uriMatches>/install/.*</uriMatches>
      </not>
      <not>
        <condition>
          <class>sonia.blog.app.InstalledCondition</class>
        </condition>
      </not>
      <uriMatches>.*\.jab</uriMatches>
    </conditions>
    <actions>
      <redirect>/install/step1.jab</redirect>
    </actions>
    <last />
  </rule>

  <rule>
    <conditions>
      <uriMatches>/install/.*</uriMatches>
      <condition>
        <class>sonia.blog.app.InstalledCondition</class>
      </condition>
    </conditions>
    <actions>
      <redirect>/</redirect>
    </actions>
  </rule>

  <rule>
    <conditions>
      <not>
        <scheme>https</scheme>
      </not>
      <uriMatches>(/personal/.*|/login.jab|/register.jab|/lostPassword.jab)</uriMatches>
      <condition>
        <class>sonia.blog.app.ConfigCondition</class>
        <init-param>
          <param-name>key</param-name>
          <param-value>ssl.enable</param-value>
        </init-param>
      </condition>
    </conditions>
    <actions>
      <action>
        <class>sonia.blog.app.SSLRedirectAction</class>
      </action>
    </actions>
  </rule>

  <rule>
    <conditions>
      <or>
        <uriMatches>/personal/.*</uriMatches>
        <uriMatches>/view/reader/.*</uriMatches>
      </or>
      <not>
        <loggedIn />
      </not>
    </conditions>
    <actions>
      <redirect>/error/403.jab</redirect>
    </actions>
    <last />
  </rule>

  <rule>
    <conditions>
      <or>
        <uriMatches>/personal/admin/.*</uriMatches>
        <uriMatches>/view/admin/.*</uriMatches>
      </or>
      <not>
        <or>
          <isUserInRole>ADMIN</isUserInRole>
          <condition>
            <class>sonia.blog.app.GlobalAdminCondition</class>
          </condition>
        </or>
      </not>
    </conditions>
    <actions>
      <redirect>/error/403.jab</redirect>
    </actions>
    <last />
  </rule>

  <rule>
    <conditions>
      <or>
        <uriMatches>/personal/author/.*</uriMatches>
        <uriMatches>/view/author/.*</uriMatches>
      </or>
      <not>
        <or>
          <isUserInRole>AUTHOR</isUserInRole>
          <isUserInRole>ADMIN</isUserInRole>
          <condition>
            <class>sonia.blog.app.GlobalAdminCondition</class>
          </condition>
        </or>
      </not>
    </conditions>
    <actions>
      <redirect>/error/403.jab</redirect>
    </actions>
    <last />
  </rule>

  <rule>
    <conditions>
      <or>
        <uriMatches>/personal/globaladmin/.*</uriMatches>
        <uriMatches>/view/globaladmin/.*</uriMatches>
      </or>
      <not>
        <condition>
          <class>sonia.blog.app.GlobalAdminCondition</class>
        </condition>
      </not>
    </conditions>
    <actions>
      <redirect>/error/403.jab</redirect>
    </actions>
    <last />
  </rule>

  <rule>
    <conditions>
      <uriMatches>.*\.xhtml</uriMatches>
    </conditions>
    <actions>
      <redirect>/error/403.jab</redirect>
    </actions>
  </rule>

</access-config>
